"title","content","articles","url"
"Op-ed: Consensus algorithms can be engineered to unlock blockchain for business","Connecting traditional businesses with blockchain technology requires merging the pBFT consensus algorithm and asynchronous model to ensure compliance, data privacy, and scalable enterprise solutions.","The following is a guest post by Venom Foundation CTO Christopher Louis Tsu.

Connecting blockchain to traditional businesses is not a simple process. So-called non-crypto industries, particularly finance, banking and insurance, are markedly disconnected because each possesses a general modus operandi that does not neatly fit into current blockchain solutions.

Concerns in these fields abound over security, compliance and cloud computing and how this fits into implementing on-chain technology. Here are two disjointed worlds, which can be brought together through fintech and blockchain innovations. But this is not a straightforward process.

The truth is it’s hard to create a layer one solution, a blockchain, which adheres to the principles of decentralization and transparency without sacrificing the important aspects of data privacy and regulatory compliance.

Those working to build the blockchain-based future need to pay close attention to these latter features. In the absence of proper data protocols, traditional finance executives are unlikely to adopt the technology — nor will the tangentially related banking and insurance industries — while careful consideration must be taken to avoid the ire of lawmakers.

The tempting solution for hungry innovators is to abandon fundamental crypto principles. In the process, they would lose sight of what makes the technology so robust and inherently scalable. But it does not have to be this way.

Overcoming the Challenges

Moderating the hype around blockchain is important to create sustainable, versatile and pertinent solutions to the non-crypto industries which can actually be improved with the technology. Not all sectors need blockchain; this article mentions finance and banking as potential leaders of adoption, because these are examples where applications make a lot of sense.

Increased security and efficiency is a compelling case for the finance sector with the added benefit of more transparent governance, a lower risk of fraud, and reduction of counterparty risk. Insurance companies will look at smart contracts in order to streamline claims processes and enjoy stronger security. Meanwhile, clearance and settlement can be much cheaper and faster using distributed ledgers. Evidently tremendous amounts of money can be saved by large companies handling enormous volumes of capital flow.

As always, implementation presents challenges to innovators. But we can ascertain the major prerequisites for an adoptable blockchain network: it needs to offer complete data privacy and be compliant with legislation that hasn’t even been written and relevant existing legal structures. Businesses will only work with an unfailingly compliant solution and not a single major, public blockchain currently meets these standards. However, adroit engineering of new solutions promises much.

The key lies in iterative advances in technology as witnessed over the past two decades. A blockchain can work in enterprise without compromise, but it needs to be configured in a novel way.

The choice of consensus algorithm carries, of course, vital importance. Yet the steps taken to implement this into a blockchain and how the system is engineered are just as salient. The blockchain trilemma, and the aforementioned prerequisites for an enterprise blockchain, cannot be solved satisfactorily without a shrewdly designed system that makes clever use of multiple technologies.

Consensus is an ever-growing field of research pertaining to blockchain; there is no surprise in technical quarters that hundreds of layer one solutions are being prepared for market, in some cases with wildly different approaches.

One compelling technical solution lies in the Practical Byzantine Fault Tolerance (pBFT) consensus algorithm, a sustainability-led shift from Proof of Work. Yet the heavy lifting cannot be done by pBFT alone. If it could, companies would have done so already.

To unlock the immense potential of a blockchain with pBFT one may look towards a technology still heavily used in Web2 which, when integrated properly, provides enormous upside for businesses not yet convinced by existing chains.

Merging Two Evolution Cycles

pBFT proves to be a highly streamlined method for reaching consensus in a distributed environment while maintaining bulletproof robustness, demonstrable in huge ecosystems: examples include the Cosmos Blockchains on Tendermint consensus, Hyperledger and many others. There is no doubt that static and dynamic sharding are among the fastest approaches to consensus in production, which pBFT does.

But what we haven’t seen often is pBFT implemented with an asynchronous model. This is the golden ticket to both satisfying traditional enterprise needs and retaining ironclad crypto security, while leaving the door wide open for decentralized applications.

pBFT has evolved as an energy efficient way of smart contract execution in a trustless decentralized environment, at the same time the asynchronous model has grown to be favored by traditional enterprise architects, such as Kafka and Akka, as an efficient way to parallelize execution in a clustered environment.

Asynchronous stateless communication, as opposed to stateful, is generally used by all traditional clustered databases, all distributed queues and even many app caches. Stateless is far less resource intensive because the system does not need to track session details and multiple links, and the asynchronous model itself ensures transaction throughput can remain high as nodes do not need to wait for other nodes to receive their messages.

In a stateless system, no information needs to be stored nor does it necessitate a response, tracking or the resending of requests in the absence of a response. Consider this protocol as a highly streamlined engine which eliminates bandwidth-hogging processes wherever possible.

Now when we talk of parallelizing execution, we can often take this to mean dynamic and static sharding — it’s the most popular method, especially within a blockchain context. Splitting and storing a dataset across multiplicitous databases and adding more machines allows vast volumes of data to be stored effectively to scale to manage ever-increasing data flows and rapid traffic growth.

A combination of pBFT and the asynchronous model shows a structure’s markings to create a blockchain that does the job rapidly, at scale, and to the high requirements of lawmakers and business leaders.

The Emerging Role of pBFT in Enterprise

pBFT is a consensus algorithm designed in the 1990s to solve problems in many available Byzantine Fault Tolerance solutions. Now it seems tailor-made for blockchain applications in non-crypto businesses, apt for those involving a consortium of enterprise organizations because each organization can represent a node on the network — with each of these nodes programmed to have clusters of instances and load balancers behind the node’s endpoint.

This means computational power can be massively scaled without compromising on a rapid response time. High levels of security are ensured without sacrificing an incredibly cost-effective communication overhead.

With a substantial majority required to confirm transactions, the system is set up to work even in situations where validators crash or maliciously broadcast incorrect information. And the crucial function of nodes here is underlaid by verification. Each network user must verify their identity so such a system passes KYC with flying colors.

pBFT is, in essence, designed to ensure robust data consistency with no danger of data loss in the event several nodes go offline or hardware failure occurs.

Yet data can be protected and kept private without compromising the transparency of transactions to those allowed access; any node without the user’s private key cannot forge its identity or the message’s signature. The system is inherently reliable because the cost of attempting such a forgery is astronomical.

Moreover, pBFT allows a distributed system to reach consensus despite an event where several nodes act to subvert the system. Every node performs computations for verifiability, security, and peace due to the inbuilt usage of cryptographic algorithms such as signature, signature verification, and hash.

The green light from lawmakers is plausible because imminent regulations can be considered, especially regarding the potential for fraud and money laundering. Traditional businesses will meanwhile need their operations to remain compliant without disposing of proper data protection — necessary in the EU with GDPR, but further desirable for many jurisdictions, businesses, and customers — and with no loss of data privacy.

Anti Money Laundering (AML), standard banking transactions, and clearing and settlement, once made possible on a blockchain without drawbacks or legal issues, could lead to a wave of adoption in finance and banking as a much better solution than those being used already.

And in terms of economic logic, a strong case for the asynchronous model here is wrapped in the parallelization aspect. While major blockchains grapple with the issue of scaling to handle high volumes of traffic, here lies an inbuilt sharding protocol that exponentially increases the limit without increasing costs.

A Feasible Path to Adoption

Common logic dictates companies will adopt a blockchain with a reliably high network speed and low transaction fees. Costs do come secondary to necessities regarding compliance and data protection, but it forms a crucial hinge upon which widespread adoption can happen. pBFT combined with an asynchronous model promises low fees, high speed and reliability, and data redundancy if implemented.

Using an asynchronous model bolsters network security as a limited number of nodes can behave unpredictably or arbitrarily without compromising the system’s safety. pBFT tolerates byzantine faults in an asynchronous network and uses the view-change protocol to guarantee liveness — which means the client finally receives the correct replies to their requests. This works exceptionally well in an asynchronous environment such as the Internet.

With pBFT ensuring a network attack is highly improbable. With the confidence that delays to consensus will not be indefinite, an asynchronous stateless model can create a blockchain that serves both the traditional and crypto worlds.

Enterprise demands are not broadly changing. Therefore, innovators must deliver a blockchain that meets these demands. Achieving this would open the gates to adoption.

POSTED IN: ENTERPRISE, OPINION, TECHNOLOGY
AUTHOR
Christopher Louis Tsu  
CTO at Venom Foundation

Christopher Louis Tsu is CTO of the Venom Foundation blockchain and a veteran entrepreneur with 37 years in tech, during which he founded four start-up companies in EDA, electronic design automation tools, digital TV, satellite comms, and medical biotech.

LATEST REPORT
Inside the macro chaos that’s shaping Bitcoin

CryptoSlate's latest market report dives deep into the key macro factors in the U.S. that could impact Bitcoin's price in the coming months.

Andjela Radmilac · 4 days ago
Latest Consensus Stories
India wants consensus on crypto regulation among G20 members this year
Regulation3 months ago1 min read
Solana co-founder Yakovenko wants “consensus at the speed of light” with over 20k validators
Bear Market6 months ago3 min read
Developer consensus supports Ethereum withdrawals in upcoming Shanghai upgrade
Technology8 months ago2 min read

Disclaimer: Our writers' opinions are solely their own and do not reflect the opinion of CryptoSlate. None of the information you read on CryptoSlate should be taken as investment advice, nor does CryptoSlate endorse any project that may be mentioned or linked to in this article. Buying and trading cryptocurrencies should be considered a high-risk activity. Please do your own due diligence before taking any action related to content within this article. Finally, CryptoSlate takes no responsibility should you lose money trading cryptocurrencies.","https://cryptoslate.com/op-ed-consensus-algorithms-can-be-engineered-to-unlock-blockchain-for-business/"
"Britain’s fourth largest newspaper offers free King Charles coronation NFTs","The Evening Standard is allowing Nifty Gateway users to mint their own cryptocollectible featuring the famous St. Edwards Crown.","The Evening Standard said on May 5 that it is releasing a series of free non-fungible tokens (NFTs) to commemorate the coronation of King Charles.

NFT features animated St. Edward’s Crown

The collectible NFT includes an animated copy of “The Oath” by Trevor Jones. This painting features St. Edward’s Crown, the centerpiece of the UK’s Crown Jewels.

The non-fungible token is currently available for free on the Nifty Gateway marketplace. Users only need to provide an email address to register and collect the item, though it is unclear whether users need to pay a  transaction fee to receive the item.

The NFT is “open edition,” meaning that there is no limit on the number of NFTs that can be minted. Users have minted 9,200 copies of the NFT as of 11:30 p.m. UTC on May 5.

Though there is no limit on the number of minted NFTs, there is a time limit. Users can only mint the token between Thursday, May 4 and Sunday, May 7.

The event represents a move into crypto from a major UK company. The Evening Standard was the UK’s fourth largest daily paper by circulation in 2020 following The Metro, The Sun, and The Daily Mail. It circulated over 314,000 papers per day in January 2023.

The state of crypto in Britain

The UK government previously announced its desire for the country to become a “crypto hub” in April 2022. This originally included plans for the Royal Mint to issue its own NFT, though those plans were ultimately dropped in March 2023.

The UK has more recently announced plans to create post-Brexit crypto regulation and currently has strict regulations from The Financial Conduct Authority (FCA). The FCA has  recently cracked down on unregistered crypto ATMs and non-compliant advertising, and the agency has even targeted specific crypto companies such as Binance.

Statista suggests that the UK crypto industry could see $1.89 billion in revenue in 2023.

POSTED IN: U.K., NFTS, POLITICS
AUTHOR
Mike Dalton
Journalist at CryptoSlate

Mike trained in library and information sciences before moving into crypto writing in 2018. He lives on the West Coast of Canada.

LATEST REPORT
Inside the macro chaos that’s shaping Bitcoin

CryptoSlate's latest market report dives deep into the key macro factors in the U.S. that could impact Bitcoin's price in the coming months.

Andjela Radmilac · 4 days ago
Latest Britain Stories
Britain’s new ‘pro-crypto’ Prime Minister slammed as ‘no friend of Bitcoin’
CBDCs7 months ago2 min read
BitMEX Co-Founder becomes Britain’s first Bitcoin billionaire
Adoption5 years ago3 min read
UK set to carve out its own path for crypto regulation post-Brexit
Regulation3 weeks ago2 min read

Disclaimer: Our writers' opinions are solely their own and do not reflect the opinion of CryptoSlate. None of the information you read on CryptoSlate should be taken as investment advice, nor does CryptoSlate endorse any project that may be mentioned or linked to in this article. Buying and trading cryptocurrencies should be considered a high-risk activity. Please do your own due diligence before taking any action related to content within this article. Finally, CryptoSlate takes no responsibility should you lose money trading cryptocurrencies.","https://cryptoslate.com/britains-fourth-largest-newspaper-offers-free-king-charles-coronation-nfts/"
"Google could lose the AI race, leaked doc says","A Google engineer suggested that his company should work with the open-source community — something that it has done with browsers, Android, and crypto.","A senior Google engineer said that both OpenAI and his own company could lose AI development race, as seen in an internal document leaked on May 4.

Google, OpenAI could lose against open-source

Google has discussed its AI plans in an earnings call and has publicly begun to offer a chatbot called Bard. However, the firm has countless other AI research efforts underway internally, and now, an engineer has suggested that those efforts may not be enough.

The anonymous Google engineer wrote:

“The uncomfortable truth is … we aren’t positioned to win this arms race and neither is OpenAI. While we’ve been squabbling, a third faction has been quietly eating our lunch.”

That third faction, the anonymous engineer said, is the open-source community, which is currently “lapping” Google and is open to anyone with a “beefy laptop.”

The engineer said that the open-source community has already solved problems that Google and other closed developers struggle with. He cited Meta’s LLaMA as the open-source community’s first “really capable foundation model.” Despite its infancy, the community began to improve upon LLaMA within days of its leak on March 3.

The engineer also commented on Google’s competition with ChatGPT creator OpenAI. He argued that although OpenAI has recruited researchers from Google, it faces the same challenges that Google does and will eventually be “eclipsed” by open source.

Google should work with open-source

The engineer suggested that competing directly with open source is a “losing proposition,” noting that users will not pay for restricted models when free and unrestricted models exist.

As such, he said that Google should cooperate with the open-source community. He noted that Google has already done this with other open-source products, such as its Chrome web browser and its mobile operating system, Android.

Google’s cloud division has also worked extensively with numerous open-source blockchain projects — including Polygon, Solana, and Tezos, among others.

POSTED IN: AI, TECHNOLOGY
AUTHOR
Mike Dalton
Journalist at CryptoSlate

Mike trained in library and information sciences before moving into crypto writing in 2018. He lives on the West Coast of Canada.

LATEST REPORT
Inside the macro chaos that’s shaping Bitcoin

CryptoSlate's latest market report dives deep into the key macro factors in the U.S. that could impact Bitcoin's price in the coming months.

Andjela Radmilac · 4 days ago
Latest Google Stories
Polygon partners with Google Cloud as Filecoin breaks into cloud market
Partnerships2 weeks ago2 min read
Google taking ‘safe and responsible’ approach to AI development; continues to add it to product suite
AI2 weeks ago3 min read
Alchemy Pay token price spikes 67% following support for Google Pay
Trading3 months ago1 min read

Disclaimer: Our writers' opinions are solely their own and do not reflect the opinion of CryptoSlate. None of the information you read on CryptoSlate should be taken as investment advice, nor does CryptoSlate endorse any project that may be mentioned or linked to in this article. Buying and trading cryptocurrencies should be considered a high-risk activity. Please do your own due diligence before taking any action related to content within this article. Finally, CryptoSlate takes no responsibility should you lose money trading cryptocurrencies.","https://cryptoslate.com/google-could-lose-the-ai-race-leaked-doc-says/"
"Binance probed by DOJ over potential Russian sanctions violations","The company and its executive have not been charged with wrongdoing.","The U.S. Department of Justice (DOJ) is looking into possible violations of Russian sanctions by Binance, Bloomberg reported May 5.

Specifically, the DOJ’s national security division intends to determine whether Binance or its executives circumvented sanctions around Russia’s invasion of Ukraine. Numerous sanctions of this type were imposed beginning in early 2022, and Binance seemingly responded by limiting its services to Russia in April 2022.

The investigation is being conducted in parallel with another ongoing inquiry from the DOJ’s criminal vision, according to Bloomberg’s sources.

Binance and its executives have not yet been accused of wrongdoing, and the probe has not been officially announced or previously reported, Bloomberg said. Instead, it obtained its information from five individuals with knowledge of the matter.

Bloomberg’s sources said that Binance has previously engaged with the DOJ to resolve other issues around compliance, particularly those concerning Iranian sanctions evasion.

Incidentally, Senator Elizabeth Warren addressed Binance’s role in handling cryptocurrency from Iran’s Islamic Revolutionary Guard Corps on May 4.

Elsewhere, the U.S. Commodity Futures Trading Commission (CFTC) filed charges against Binance on March 27, alleging Binance allowed users to illegally access commodities.

POSTED IN: BINANCE, RUSSIA, U.S., EXCHANGES, REGULATION
AUTHOR
Mike Dalton
Journalist at CryptoSlate

Mike trained in library and information sciences before moving into crypto writing in 2018. He lives on the West Coast of Canada.

LATEST REPORT
Inside the macro chaos that’s shaping Bitcoin

CryptoSlate's latest market report dives deep into the key macro factors in the U.S. that could impact Bitcoin's price in the coming months.

Andjela Radmilac · 4 days ago
Latest Binance Stories
Binance’s NFT marketplace to support Bitcoin Ordinals
Exchanges16 hours ago2 min read
Binance says Bitcoin ‘outflows’ are internal wallet movements
Exchanges2 days ago1 min read
Binance working to enable Bitcoin lightning network
Exchanges2 days ago2 min read

Disclaimer: Our writers' opinions are solely their own and do not reflect the opinion of CryptoSlate. None of the information you read on CryptoSlate should be taken as investment advice, nor does CryptoSlate endorse any project that may be mentioned or linked to in this article. Buying and trading cryptocurrencies should be considered a high-risk activity. Please do your own due diligence before taking any action related to content within this article. Finally, CryptoSlate takes no responsibility should you lose money trading cryptocurrencies.","https://cryptoslate.com/binance-probed-by-doj-over-potential-russian-sanctions-violations/"
